{
  "$schema": "../schema/ledger.schema.json",
  "schemaVersion": 1,
  "baseline": "19511bb171f3b360b006c94cf6d07e53cb446505",
  "owner": "bsolid-lifecycle",
  "sources": [
    { "path": "packages/utils/src/useTimeout.ts", "blob": "dfdaf4c7e0c51dde5ea9245a97957e2792b991b2", "targets": ["packages/solid/src/utils/createTimeout.ts"], "disposition": "translated", "reason": "Setup-owned onCleanup is a custom-primitive boundary, including disposal before first settle; class remains imperative and restartable." },
    { "path": "packages/utils/src/useInterval.ts", "blob": "88d897e49e842d5202b1bc44f7fd37a52a7fc45b", "targets": ["packages/solid/src/utils/createInterval.ts"], "disposition": "translated", "reason": "Preserves Timeout subclass, restart and clearInterval semantics with setup ownership." },
    { "path": "packages/utils/src/useAnimationFrame.ts", "blob": "8033fe6659e7c12eedf8358427956f0ff16bcf10", "targets": ["packages/solid/src/utils/createAnimationFrame.ts"], "disposition": "translated", "reason": "Batched FIFO frames, unique scheduler IDs, repeated cancellation and reset preserved. Deliberate disposal strengthening: cancel native frame when last callback removed; owned instance guards cancellation after batch snapshot." },
    { "path": "packages/utils/src/useIdleCallback.ts", "blob": "ec7aefa19136c52a029dc93239e6e713a64262de", "targets": ["packages/solid/src/utils/createIdleCallback.ts"], "disposition": "translated", "reason": "Native idle or macrotask fallback; each request captures its matching cancellation source. No after-paint guarantee for fallback." },
    { "path": "packages/utils/src/useStableCallback.ts", "blob": "5dd957e39822a0e31d6862b42c9d91c2065a907d", "targets": ["packages/solid/src/utils/createStableCallback.ts"], "disposition": "translated", "reason": "Accessor of current handler read untracked at invocation; no insertion-effect relay or React render-phase shim. Intended for imperative/event calls." },
    { "path": "packages/utils/src/useMergedRefs.ts", "blob": "8f7a4a7a789d61b01aad137759cb0efd1379c878", "targets": ["packages/solid/src/utils/createMergedRefs.ts"], "disposition": "translated", "reason": "Stable callback even for empty refs retains raw host for later ref additions. N accepts live array accessor. Native arrays flattened, internal cells supported. Callback returns ignored per RC13; composed callbacks must tolerate owner-supplied null detach. Setup cleanup plus transparent memo/split effect with returned cleanup; no primitives in ref invocation." },
    { "path": "packages/utils/src/useId.ts", "blob": "2d2cf04dbe9a6c11039b7361931ab82e186ccdc4", "targets": ["packages/solid/src/utils/createId.ts"], "disposition": "translated", "reason": "Public RC13 createUniqueId allocated once; live override accessor uses nullish fallback preserving empty strings. No counter/random/private owner IDs. Consumers provide matching distinct renderId namespaces for separately hydrated roots." },
    { "path": "packages/react/src/internals/useBaseUiId.ts", "blob": "c46d78204bfcc6743c2fce2fd74ecb683cbe73f6", "targets": ["packages/solid/src/internals/createBaseUiId.ts"], "disposition": "translated", "reason": "Accessor result with source base-ui prefix and explicit useBaseUiId alias." },
    { "path": "packages/utils/src/hydration.ts", "blob": "0e191f536b6e92ad3a3d8f205743652a4f7ae62a", "targets": ["packages/solid/src/utils/hydration.ts"], "disposition": "translated", "reason": "Public isServer/isHydrating seed, onSettled client transition; Base UI hydrating includes server rendering. Returns reactive accessors." },
    { "path": "packages/react/src/utils/useIsHydrating.ts", "blob": "06b12eaee918b0cb3d07fc3b47243c4079151e40", "targets": ["packages/solid/src/utils/createIsHydrating.ts"], "disposition": "translated", "reason": "Retained re-export and explicit alias." },
    { "path": "packages/react/src/utils/resolveRef.ts", "blob": "01bfdfe91ea706f67a66234c4f084e8cb4ce3ebc", "targets": ["packages/solid/src/utils/resolveRef.ts"], "disposition": "translated", "reason": "Raw element/null/undefined, live accessor and internal MutableCell; no React ref object dependency." },
    { "path": "packages/react/src/internals/RequestQueue.ts", "blob": "7d9169d5555c6151c922455f063f4c038c779582", "targets": ["packages/solid/src/internals/RequestQueue.ts"], "disposition": "pure-adapted", "reason": "Source algorithm retained including explicit success settlement, rejection removal, FIFO, protected pickEntries, key replacement and clear semantics. clear forgets bookkeeping, not network cancellation." },
    { "path": "packages/react/src/internals/TimeoutManager.ts", "blob": "97b6c91509042b436a432b5903300738c1254c5a", "targets": ["packages/solid/src/internals/TimeoutManager.ts"], "disposition": "pure-adapted", "reason": "Keyed class retained; additional createTimeoutManager owns clearAll during setup." },
    { "path": "packages/utils/src/useAnimationFrame.test.ts", "blob": "66d0c7b38f943f629832fce3dc61f2b441b3a56a", "targets": ["packages/solid/src/utils/createTimeout.lifecycle.test.tsx"], "disposition": "translated", "reason": "Duplicate cancellation accounting plus native cancellation, reset, nested batch and disposal tests." },
    { "path": "packages/utils/src/useIdleCallback.fallback.test.ts", "blob": "c30bf25ad4e8e4740484c74a58ceb32e8cedacc5", "targets": ["packages/solid/src/utils/createTimeout.lifecycle.test.tsx"], "disposition": "translated", "reason": "Fallback replacement and clear plus cancellation source retention." },
    { "path": "packages/utils/src/useMergedRefs.test.tsx", "blob": "f3dd8d65082c8f40f21bf50215b7dd782eb15cbc", "targets": ["packages/solid/src/utils/createMergedRefs.lifecycle.test.tsx"], "disposition": "translated", "reason": "Forking, single/empty refs, adding refs, replacing refs and disposal mapped; React cleanup-return assertion adapted to native ignored-return contract." },
    { "path": "packages/utils/src/useId.test.tsx", "blob": "7b7f1c72b853fdcbdfe2f8b937a41d1a3438e369", "targets": ["packages/solid/src/utils/createId.lifecycle.test.tsx", "packages/solid/src/utils/createId.emit.tsx"], "disposition": "translated", "reason": "Provided/generated/live IDs, suffix, multiple IDREFs, prefix and server ID mapped; empty override and concurrent request/multiple root proofs added." },
    { "path": "packages/utils/src/hydration.test.tsx", "blob": "ecd5dad0c769809bb343fbf04192eeb95778a015", "targets": ["packages/solid/src/utils/createId.lifecycle.test.tsx", "packages/solid/src/utils/createId.fixture.tsx"], "disposition": "translated", "reason": "Modern client/server boolean outcomes preserved; four React17 shim/version-routing cases are framework-only and intentionally not reimplemented." },
    { "path": "packages/react/src/internals/RequestQueue.test.ts", "blob": "b9f52174e5e0d66022822bb62824f40d1170baa4", "targets": ["packages/solid/src/internals/RequestQueue.lifecycle.test.ts"], "disposition": "translated", "reason": "All ten source assertions grouped in four focused tests: each-key fetch, status, pending duplicate, max concurrency, settlement, clearPending, clear, reject, complex keys, FIFO." },
    { "path": "packages/react/src/internals/TimeoutManager.test.ts", "blob": "2ab085149e2562d210cab59a842e3b48da39ad42", "targets": ["packages/solid/src/internals/TimeoutManager.lifecycle.test.ts", "packages/solid/src/utils/createTimeout.lifecycle.test.tsx"], "disposition": "translated", "reason": "Six source assertions grouped: delay, replacement, clear, missing clear, clearAll, clear after fire; owner disposal added." }
  ],
  "cases": [
    { "id": "lifecycle/resources", "sourcePath": "packages/utils/src/useTimeout.ts", "sourceBlob": "dfdaf4c7e0c51dde5ea9245a97957e2792b991b2", "kind": "runtime-case", "status": "passing", "targets": ["packages/solid/src/utils/createTimeout.lifecycle.test.tsx"], "reason": "Six focused tests exercise restart, before-first-settle disposal, latest callback, interval repetition, idle fallback/source cancellation, batched frames and disposal within the current frame.", "evidence": ["rtk pnpm test:jsdom lifecycle --no-watch: focused runtime tests pass; unexpected diagnostics and owner/timer leaks remain harness failures."], "blockers": [] },
    { "id": "lifecycle/refs", "sourcePath": "packages/utils/src/useMergedRefs.test.tsx", "sourceBlob": "f3dd8d65082c8f40f21bf50215b7dd782eb15cbc", "kind": "runtime-case", "status": "passing", "targets": ["packages/solid/src/utils/createMergedRefs.lifecycle.test.tsx"], "reason": "Three tests cover raw identity, nested arrays, ownerless attachment, ignored returns, replacement/disposal exactly once, empty-to-live refs, live accessor resolution. Native semantics replace React clone/ref mechanics.", "evidence": ["Focused jsdom suite passes with getOwner null assertions and genuine harness lifetime diagnostics."], "blockers": [] },